{
  "schemaVersion": "eval-policy.v1",
  "id": "tpa-cowork-release-deterministic",
  "version": "1.0.0",
  "tier": "release",
  "mode": "advisory",
  "allowedAdapters": [
    "coding_fixture_patch",
    "coding_gold_fixture_patch",
    "domain_trace_fixture",
    "dreaming_golden",
    "memory_retrieval_scale"
  ],
  "suites": [
    { "id": "coding-control-plane", "minPassRate": 1.0 },
    { "id": "coding-gold", "minPassRate": 1.0 },
    { "id": "domain-trace", "minPassRate": 1.0 },
    { "id": "memory-dreaming", "minPassRate": 1.0 },
    { "id": "memory-retrieval-scale", "minPassRate": 1.0 }
  ],
  "performanceBlocking": false,
  "maxDurationSeconds": 1800
}
